C001967_pt_000	Operador de máquinas de fabrico de péletes de madeira/ Operadora de máquinas de fabrico de péletes de madeira
C001967_pt_001	Operador de máquinas de fabrico de péletes de madeira
C001967_pt_002	Operadora de máquinas de fabrico de péletes de madeira
C001968_pt_000	Hospedeiro de terra/Hospedeira de terra
C001968_pt_001	Hospdedeita de terra
C001968_pt_002	Hospedeiro de terra
C001969_pt_000	Inspetor agrícola/Inspetora agrícola
C001969_pt_001	Inspetor agrícola
C001969_pt_002	Inspetora agrícola
C001970_pt_000	Operador de revelação de fotografias/ Operadora de revelação de fotografias
C001970_pt_001	Operador de revelação de fotografias
C001970_pt_002	Operadora de fotografias
C001970_pt_003	Técnica de laboratório fotográfico
C001970_pt_004	Técnico de laboratório fotográfico
C001971_pt_000	Assistente de direção de imagem
C001972_pt_000	Montador de baterias/Montadora de baterias
C001972_pt_001	Montador de baterias
C001972_pt_002	Montador de componentes de baterias
C001972_pt_003	Montadora de baterias
C001972_pt_004	Montadora de componentes de baterias
C001973_pt_000	Operador de máquinas de fabrico de artigos em papel/ Operadora de máquinas de fabrico de artigos em papel
C001973_pt_001	Operador de máquinas de fabrico de artigos em papel
C001973_pt_002	Operadora de máquinas de fabrico de artigos em papel
C001974_pt_000	Vendedor de materiais de construção/Vendedora de materiais de construção
C001974_pt_001	Vendedor de materiais de construção
C001974_pt_002	Vendedora de materiais de construção
C001975_pt_000	Agente de prevenção de perdas em estabelecimentos comerciais
C001976_pt_000	Supervisor de dragagem/Supervisora de dragagem
C001976_pt_001	Supervisor de dragagem
C001976_pt_002	Supervisora de dragagem
C001977_pt_000	Médico generalista/Médica generalista
C001977_pt_001	Médica de clínica geral
C001977_pt_002	Médica generalista
C001977_pt_003	Médico de clínica geral
C001977_pt_004	Médico generalista
C001978_pt_000	Vendedor de calçado e acessórios em couro/Vendedora de calçado e acessórios em couro
C001978_pt_001	Vendedor de calçado e acessórios em couro
C001978_pt_002	Vendedora de calçado e acessórios em couro
C001979_pt_000	Vereador/Vereadora
C001979_pt_001	Autarca
C001979_pt_002	Membro do gabinete
C001979_pt_003	Vereador
C001979_pt_004	Vereadora
C001980_pt_000	Operador de prensa de fruta/Operadora de prensa de fruta
C001980_pt_001	Operador de instalação de prensagem de fruta
C001980_pt_002	Operador de prensa de fruta
C001980_pt_003	Operadora de instalação de prensagem de fruta
C001980_pt_004	Operadora de prensa de fruta
C001980_pt_005	Prensador de fruta
C001980_pt_006	Prensadora de fruta
C001981_pt_000	Operador de instalações de produção de eletricidade/Operadora de instalações de produção de eletricidade
C001981_pt_001	Operador de instalações de produção de eletricidade
C001981_pt_002	Operadora de instalações de produção de eletricidade
C001982_pt_000	Técnico de depilação/Técnica de depilação
C001982_pt_001	Depilador
C001982_pt_002	Depiladora
C001982_pt_003	Técnica de depilação
C001982_pt_004	Técnico de depilação
C001983_pt_000	Gestor de clientes/Gestora de clientes
C001983_pt_001	Gestor de clientes
C001983_pt_002	Gestora de clientes
C001984_pt_000	Técnico de calefação/Técnica de calefação
C001984_pt_001	Técnica de calefação
C001984_pt_002	Técnico de calefação
C001985_pt_000	Matemático/Matemática
C001985_pt_001	Matemática
C001985_pt_002	Matemático
C001986_pt_000	Gestor de património/Gestora de património
C001986_pt_001	Gestor de fortunas
C001986_pt_002	Gestor de património
C001986_pt_003	Gestora de fortunas
C001986_pt_004	Gestora de património
C001987_pt_000	Operador de máquinas de destintar por flutuação/ Operadora de máquinas de destintar por flutuação
C001987_pt_001	Operador de máquinas de destintar por flutuação
C001987_pt_002	Operadora de máquinas de destintar por flutuação
C001988_pt_000	Coordenador de planos de resposta de emergência/Coordenadora de planos de resposta de emergência
C001988_pt_001	Coordenador de planos de resposta de emergência
C001988_pt_002	Coordenadora de planos de resposta de emergência
C001989_pt_000	Editor de imagens/Editora de imagens
C001989_pt_001	Editor de imagens
C001989_pt_002	Editora de imagens
C001990_pt_000	Professor de Artes Visuais/Professora de Artes Visuais
C001990_pt_001	Professor de Artes Visuais
C001990_pt_002	Professor de Escultura
C001990_pt_003	Professor de Expressão Artística
C001990_pt_004	Professor de Pintura
C001990_pt_005	Professora de Artes Visuais
C001990_pt_006	Professora de Escultura
C001990_pt_007	Professora de Expressão Artística
C001990_pt_008	Professora de Pintura
C001991_pt_000	Artesão de artigos de marroquinaria/Artesã de artigos de marroquinaria
C001991_pt_001	Artesã de artigos de marroquinaria
C001991_pt_002	Artesão de artigos de marroquinaria
C001992_pt_000	Diretor de distribuição de produtos especializados/Diretora de distribuição de produtos especializados
C001992_pt_001	Diretor de distribuição de produtos especializados
C001992_pt_002	Diretora de distribuição de produtos especializados
C001993_pt_000	Especialista em import-export de açúcar, chocolate e produtos de confeitaria
C001994_pt_000	Técnico de instrumentos/Técnica de instrumentos
C001994_pt_001	Técnica de instrumentos
C001994_pt_002	Técnico de instrumentos
C001995_pt_000	Operador de torrefação de malte/Operadora de torrefação de malte
C001995_pt_001	Operador de máquina de torrefação de malte
C001995_pt_002	Operador de torrefação de malte
C001995_pt_003	Operadora de máquina de torrefação de malte
C001995_pt_004	Operadora de torrefação de malte
C001995_pt_005	Torrador de malte
C001995_pt_006	Torradora de malte
C001996_pt_000	Empregado de quartos em hotelaria/Empregada de quartos em hotelaria
C001996_pt_001	Camareira
C001996_pt_002	Camareiro
C001996_pt_003	Empregada de limpeza
C001996_pt_004	Empregada de quartos em hotelaria
C001996_pt_005	Empregado de limpeza
C001996_pt_006	Empregado de quartos em hotelaria
C001997_pt_000	Testador de integração informática/Testadora de integração informática
C001997_pt_001	Responsável pelos testes de integração
C001997_pt_002	Responsável por testes de integração
C001997_pt_003	Testador de integração
C001997_pt_004	Testadora de integração
C001998_pt_000	Bordadeira/Bordadeiro
C001998_pt_001	Bordadeira
C001998_pt_002	Bordadeira de casa
C001998_pt_003	Bordadeiro
C001998_pt_004	Bordadeiro de casa
C001998_pt_005	Bordador
C001998_pt_006	Bordadora
C001999_pt_000	Operador de máquinas de fabrico de sacos de papel/Operadora de máquinas de fabrico de sacos de papel
C001999_pt_001	Operador de máquinas de fabrico de sacos de papel
C001999_pt_002	Operadora de máquinas de fabrico de sacos de papel
C002000_pt_000	Operador de vendas/Operadora de vendas
C002000_pt_001	Operador de vendas
C002000_pt_002	Operadora de vendas
C002001_pt_000	Operador de máquina de marcação a laser/Operadora de máquina de marcação a laser
C002001_pt_001	Operador de máquina de marcação a laser
C002001_pt_002	Operadora de máquina de marcação a laser
C002002_pt_000	Professor de cursos profissionais de Técnicas Laboratoriais/Professora de cursos profissionais de Técnicas Laboratoriais
C002002_pt_001	Professor de cursos profissionais de Técnicas Laboratoriais
C002002_pt_002	Professora de cursos profissionais de Técnicas Laboratoriais
C002003_pt_000	Operador de instalações de produção de vapor/ Operadora de instalações de produção de vapor
C002003_pt_001	Operador de instalações de produção de vapor
C002003_pt_002	Operadora de instalações de produção de vapor
C002004_pt_000	Assistente social em unidades hospitalares
C002005_pt_000	Diretor de produtos de seguros/Diretora de produtos de seguros
C002005_pt_001	Diretor de produtos de seguros
C002005_pt_002	Diretora de produtos de seguros
C002005_pt_003	Gestor de produtos de seguros
C002005_pt_004	Gestora de produtos de seguros
C002005_pt_005	Mediador de seguros
C002005_pt_006	Mediadora de seguros
C002006_pt_000	Lapidador de pedras preciosas/Lapidadora de pedras preciosas
C002006_pt_001	Lapidador de pedras preciosas
C002006_pt_002	Lapidadora de pedras preciosas
C002006_pt_003	Ourives
C002007_pt_000	Diretor de distribuição — frutos e produtos hortícolas/Diretora de distribuição — frutos e produtos hortícolas
C002007_pt_001	Diretor de distribuição — frutos e produtos hortícolas
C002007_pt_002	Diretor de logística — frutos e produtos hortícolas
C002007_pt_003	Diretora de distribuição — frutos e produtos hortícolas
C002007_pt_004	Diretora de logística — frutos e produtos hortícolas
C002008_pt_000	Senador/Senadora
C002008_pt_001	Congressista
C002008_pt_002	Senador
C002008_pt_003	Senadora
C002009_pt_000	Diretor de investigação e desenvolvimento/Diretora de investigação e desenvolvimento
C002009_pt_001	Diretor de investigação e desenvolvimento
C002009_pt_002	Diretora de investigação e desenvolvimento
C002010_pt_000	Montador de produtos em borracha/ Montadora de produtos em borracha
C002010_pt_001	Montador de produtos em borracha
C002010_pt_002	Montadora de produtos em borracha
C002011_pt_000	Diretor geral dos transportes por vias navegáveis interiores/Diretora geral dos transportes por vias navegáveis interiores
C002011_pt_001	Diretor geral dos transportes por vias navegáveis interiores
C002011_pt_002	Diretora geral dos transportes por vias navegáveis interiores
C002012_pt_000	Trabalhador da construção de esgotos/Trabalhadora da construção de esgotos
C002012_pt_001	Trabalhador da construção de esgotos
C002012_pt_002	Trabalhadora da construção de esgotos
C002013_pt_000	Designer de interiores
C002014_pt_000	Operador de distribuidor de energia elétrica/Operadora de distribuidor de energia elétrica
C002014_pt_001	Operador de distribuidor de energia elétrica
C002014_pt_002	Operadora de distribuidor de energia elétrica
C002015_pt_000	Operador de pistola de pintura/Operadora de pistola de pintura
C002015_pt_001	Operador de pistola de pintura
C002015_pt_002	Operadora de pistola de pintura
C002016_pt_000	Controlador de processos na indústria têxtil/Controladora de processos na indústria têxtil
C002016_pt_001	Controlador de processos na indústria têxtil
C002016_pt_002	Controladora de processos na indústria têxtil
C002017_pt_000	Mordomo doméstico/Governanta doméstica
C002017_pt_001	Governanta doméstica
C002017_pt_002	Mordomo doméstico
C002018_pt_000	Consultor em segurança de produtos perigosos/Consultora em segurança de produtos perigosos
C002018_pt_001	Consultor em segurança de produtos perigosos
C002018_pt_002	Consultora em segurança de produtos perigosos
C002019_pt_000	Inspetor de montagem de produtos/Inspetora de montagem de produtos
C002019_pt_001	Inspetor de montagem de produtos
C002019_pt_002	Inspetora de montagem de produtos
C002020_pt_000	Aromoterapeutra
C002021_pt_000	Gerente de banco
C002021_pt_001	Gerente de banco privado
C002021_pt_002	Gerrente de sucursal de banco
C002022_pt_000	Conservador/Conservadora
C002022_pt_001	Conservador
C002022_pt_002	Conservadora
C002023_pt_000	Técnico de manutenção de infraestruturas ferroviárias/Técnica de manutenção de infraestruturas ferroviárias
C002023_pt_001	Técnica de manutenção de infraestruturas ferroviárias
C002023_pt_002	Técnico de manutenção de infraestruturas ferroviárias
C002024_pt_000	Engenheiro do petróleo/Engenheira do petróleo
C002024_pt_001	Engenheira do petróleo
C002024_pt_002	Engenheiro do petróleo
C002025_pt_000	Especialista em grafologia
C002025_pt_001	Grafologista
C002026_pt_000	Assistente social em situações de crise e emergência social
C002027_pt_000	Técnico de energia solar/Técnica de energia solar
C002027_pt_001	Técnica de energia solar
C002027_pt_002	Técnico de energia solar
C002028_pt_000	Técnico de eletrónica ferroviária/Técnica de eletrónica ferroviária
C002028_pt_001	Técnica de eletrónica ferroviária
C002028_pt_002	Técnico de eletrónica ferroviária
C002029_pt_000	Técnico de manutenção de ductos/Técnica de manutenção de ductos
C002029_pt_001	Técnica de manutenção de ductos
C002029_pt_002	Técnica de manutenção de gasodutos
C002029_pt_003	Técnica de manutenção de oleodutos
C002029_pt_004	Técnico de manutenção de ductos
C002029_pt_005	Técnico de manutenção de gasodutos
C002029_pt_006	Técnico de manutenção de oleodutos
C002030_pt_000	Gerente de loja de mobiliário
C002030_pt_001	Gerente de loja de artigos de decoração
C002030_pt_002	Gerente de loja de decoração
C002030_pt_003	Gerente de loja de mobiliário e iluminação
C002031_pt_000	Fabricante de moldes CAD para vestuário
C002032_pt_000	Técnico de radiologia/Técnica de radiologia
C002032_pt_001	Técnica de radiologia
C002032_pt_002	Técnica de radioterapia
C002032_pt_003	Técnico de radiologia
C002032_pt_004	Técnico de radioterapia
C002033_pt_000	Consultor de perda de peso/Consultora de perda de peso
C002033_pt_001	Consultor de nutrição
C002033_pt_002	Consultor de perda de peso
C002033_pt_003	Consultora de nutrição
C002033_pt_004	Consultora de perda de peso
C002034_pt_000	Técnico de audiovisual/Técnica de audiovisual
C002034_pt_001	Técnica de audiovisual
C002034_pt_002	Técnico de audiovisual
C002035_pt_000	Operador de máquinas de fabrico de tela metálica/ Operadora de máquinas de fabrico de tela metálica
C002035_pt_001	Operador de máquinas de fabrico de tela metálica
C002035_pt_002	Operadora de máquinas de fabrico de tela metálica
C002036_pt_000	Consultor jurídico/Consultora jurídica
C002036_pt_001	Consultor jurídico
C002036_pt_002	Consultora jurídica
C002037_pt_000	Montador de motociclos/ Montadora de motociclos
C002037_pt_001	Montador de motociclos
C002037_pt_002	Montadora de motociclos
C002038_pt_000	Oficial de artilharia
C002039_pt_000	Gestor de auditores informáticos/Gestora de auditores informáticos
C002039_pt_001	Gestor de auditores de TIC
C002039_pt_002	Gestor de auditores de tecnologias da informação
C002039_pt_003	Gestor de auditores de tecnologias de informação e comunicação
C002039_pt_004	Gestor de auditores informáticos
C002039_pt_005	Gestora de auditores de TIC
C002039_pt_006	Gestora de auditores de tecnologias da informação
C002039_pt_007	Gestora de auditores de tecnologias de informação e comunicação
C002039_pt_008	Gestora de auditores informáticos
C002040_pt_000	Educador formado na pedagogia Montessori/Educadora formada na pedagogia Montessori
C002040_pt_001	Educador Montessori
C002040_pt_002	Educador do método Montessori
C002040_pt_003	Educador formado na pedagogia Montessori
C002040_pt_004	Educadora Montessori
C002040_pt_005	Educadora do método Montessori
C002040_pt_006	Educadora formada na pedagogia Montessori
C002041_pt_000	Engenheiro especialista em finalização de projetos/Engenheira especialista em finalização de projetos
C002041_pt_001	Engenheira especialista em finalização de projetos
C002041_pt_002	Engenheiro especialista em finalização de projetos
C002042_pt_000	Técnico de próteses dentárias/Técnica de próteses dentárias
C002042_pt_001	Técnica de próteses dentárias
C002042_pt_002	Técnico de próteses dentárias
C002043_pt_000	Artista de variedades
C002044_pt_000	Hacker ético/Hacker ética
C002044_pt_001	Analista de segurança informática
C002044_pt_002	Analista de vulnerabilidade
C002044_pt_003	Hacker ética
C002044_pt_004	Hacker ético
C002044_pt_005	Testador de segurança informática
C002044_pt_006	Testadora de segurança informática
C002045_pt_000	Montador de joias/Montadora de joias
C002045_pt_001	Montador de joias
C002045_pt_002	Montadora de joias
C002045_pt_003	Ourives
C002046_pt_000	Ortóptico/Ortóptica
C002046_pt_001	Ortóptica
C002046_pt_002	Ortóptico
C002047_pt_000	Gerente de instalações recreativas
C002047_pt_001	Gerente de centro cultural
C002047_pt_002	Gerente de instalações de lazer
C002047_pt_003	Gerente de instalações desportivas
C002047_pt_004	Gerente de sala de cinema
C002048_pt_000	Detetive particular
C002048_pt_001	Detetive privada
C002048_pt_002	Detetive privado
C002049_pt_000	Revisor de títulos de transporte/Revisora de títulos de transporte
C002049_pt_001	Revisor de títulos de transporte
C002049_pt_002	Revisora de títulos de transporte
C002050_pt_000	Operador de fabrico de peças em fibra de vidro/Operador de fabrico de peças em fibra de vidro
C002050_pt_001	Moldador de artigos em fibra de vidro
C002050_pt_002	Moldadora de artigos em fibra de vidro
C002051_pt_000	Vendedor de perfumes e cosméticos/Vendedora de perfumes e cosméticos
C002051_pt_001	Vendedor de perfumes e cosméticos
C002051_pt_002	Vendedora de perfumes e cosméticos
C002052_pt_000	Trabalhador florestal/Trabalhadora florestal
C002052_pt_001	Operador florestal
C002052_pt_002	Operadora florestal
C002052_pt_003	Silvicultor
C002052_pt_004	Silvicultora
C002052_pt_005	Trabalhador florestal
C002052_pt_006	Trabalhadora florestal
C002053_pt_000	Organizador de espaços internos/Organizadora de espaços internos
C002053_pt_001	Organizador de espaços internos
C002053_pt_002	Organizadora de espaços internos
C002054_pt_000	Técnico nuclear/Técnica nuclear
C002054_pt_001	Técnica nuclear
C002054_pt_002	Técnico nuclear
C002055_pt_000	Gestor de segurança informática/Gestora de segurança informática
C002055_pt_001	Coordenador de segurança informática
C002055_pt_002	Coordenadora de segurança informática
C002055_pt_003	Gestor de segurança informática
C002055_pt_004	Gestora de segurança informática
C002055_pt_005	Perita em segurança informática
C002055_pt_006	Perito em segurança informática
C002055_pt_007	Responsável pela segurança informática
C002056_pt_000	Instrutor de snowboard/Instrutora de snowboard
C002056_pt_001	Instrutor de snowboard
C002056_pt_002	Instrutora de snowboard
C002057_pt_000	Engenheiro especialista em fotónica/Engenheira especialista em fotónica
C002057_pt_001	Engenheira especialista em fotónica
C002057_pt_002	Engenheiro especialista em fotónica
C002058_pt_000	Especialista em aspetos legais e regulamentares
C002059_pt_000	Operador de máquina para mobiliário de madeira/Operadora de máquina para mobiliário de madeira
C002059_pt_001	Operador de máquina para mobiliário de madeira
C002059_pt_002	Operadora de máquina para mobiliário de madeira
C002060_pt_000	Operador de máquina para rosquear por rolagem /Operadora de máquina para rosquear por rolagem
C002060_pt_001	Operador de máquina para abrir roscas em parafusos por rodagem (ou laminagem)
C002060_pt_002	Operador de máquina para fabricar cavilhas e parafusos
C002060_pt_003	Operador de máquina para rosquear por rolagem
C002060_pt_004	Operadora de máquina para abrir roscas em parafusos por rodagem (ou laminagem)
C002060_pt_005	Operadora de máquina para fabricar cavilhas e parafusos
C002060_pt_006	Operadora de máquina para rosquear por rolagem
C002061_pt_000	Engenheiro eletromecânico/Engenheira eletromecânica
C002061_pt_001	Engenheira eletromecânica
C002061_pt_002	Engenheira elétrica
C002061_pt_003	Engenheira mecânica
C002061_pt_004	Engenheiro eletromecânico
C002061_pt_005	Engenheiro elétrico
C002061_pt_006	Engenheiro mecânico
C002062_pt_000	Designer de moda
C002062_pt_001	Designer de vestuário
C002062_pt_002	Especialista em moda
C002062_pt_003	Estilista
C002062_pt_004	Estilista de moda
C002062_pt_005	Estilista de vestuário
C002063_pt_000	Técnico de reprografia/Técnica de reprografia
C002063_pt_001	Técnica de reprografia
C002063_pt_002	Técnico de reprografia
C002064_pt_000	Responsável na área das relações internacionais
C002065_pt_000	Especialista em edição eletrónica
C002065_pt_001	Especialista em DTP
C002065_pt_002	Especialista em Desktop Publishing
C002066_pt_000	Operador de máquinas de enchimento de cápsulas/ Operadora de máquinas de enchimento de cápsulas
C002066_pt_001	Operador de máquinas de enchimento de cápsulas
C002066_pt_002	Operadora de máquinas de enchimento de cápsulas
C002067_pt_000	Técnico de engenharia robotica/Técnico de engenharia robótica
C002067_pt_001	Técnica de engenharia robótica
C002067_pt_002	Técnico de engenharia robótica
C002068_pt_000	Entrevistador de estudos de mercado/Entrevistadora de estudos de mercado
C002068_pt_001	Entrevistador de estudos de mercado
C002068_pt_002	Entrevistadora de estudos de mercado
C002069_pt_000	Chefe de armazém de produtos de couro
C002069_pt_001	Capataz de armazém de produtos de couro
C002069_pt_002	Supervisor de armazém de produtos de couro
C002069_pt_003	Supervisora de armazém de produtos de couro
C002070_pt_000	Montador de peças de veículos/ Montadora de peças de veículos
C002070_pt_001	Montador de peças de automóveis
C002070_pt_002	Montador de peças de veículos
C002070_pt_003	Montadora de peças de automóveis
C002070_pt_004	Montadora de peças de veículos
C002071_pt_000	Superintendente de gaseoduto ou oleoduto
C002071_pt_001	Chefe de projeto de oleoduto ou gaseoduto
C002071_pt_002	Coordenador de rede de distribuição
C002071_pt_003	Coordenadora de rede de distribuição
C002072_pt_000	Especialista em saúde e segurança no trabalho
C002072_pt_001	Consultor em saúde e segurança no trabalho
C002072_pt_002	Consultora em saúde e segurança no trabalho
C002072_pt_003	Higienista ocupacional
C002073_pt_000	Comerciante grossista de desperdícios e sucata
C002074_pt_000	Dançaterapeuta
C002074_pt_001	Dança-terapeuta
C002074_pt_002	Terapeuta em DMT
C002074_pt_003	Terapeuta especialista em dança/Movimento terapia
C002075_pt_000	Contabilista público/Contabilista pública
C002075_pt_001	Contabilista pública
C002075_pt_002	Contabilista público
C002075_pt_003	Técnica superiora em contabilidade pública
C002075_pt_004	Técnico superior em contabilidade pública
C002076_pt_000	Operador de misturadora de especiarias/Operadora de misturadora de especiarias
C002076_pt_001	Operador de misturadora de especiarias
C002076_pt_002	Operadora de misturadora de especiarias
C002076_pt_003	Técnica de mistura de especiarias
C002076_pt_004	Técnico de mistura de especiarias
C002077_pt_000	Auxiliar de transporte escolar
C002078_pt_000	Professor de Escola Superior de Dança/Professora de Escola Superior de Dança
C002078_pt_001	Professor de Academia de Dança
C002078_pt_002	Professor de Escola Superior de Dança
C002078_pt_003	Professor de Escola de Dança do Conservatório
C002078_pt_004	Professora de Escola Superior de Dança
C002078_pt_005	Professora de Escola de Dança do Conservatório
C002079_pt_000	Técnico de apoio residencial a adultos toxicodepentes ou com deficiência /Técnica de apoio residencial a adultos toxicodepentes ou com deficiência
C002079_pt_001	Técnica de apoio residencial a adultos toxicodepentes ou com deficiência
C002079_pt_002	Técnico de apoio residencial a adultos toxicodepentes ou com deficiência
C002080_pt_000	Operário da marcação de estradas/Operária da marcação de estradas
C002080_pt_001	Operária da marcação de estradas
C002080_pt_002	Trabalhador não qualificado da marcação de estradas
C002081_pt_000	Designer sonoro/Designer sonora
C002081_pt_001	Artista sonora
C002081_pt_002	Artista sonoro
C002081_pt_003	Assistente de som
C002081_pt_004	Criador sonoro
C002081_pt_005	Criadora sonora
C002081_pt_006	Designer de som
C002081_pt_007	Designer sonora
C002081_pt_008	Designer sonoro
C002081_pt_009	Sonoplasta
C002082_pt_000	Gerente de frutaria
C002082_pt_001	Gerente de mercearia
C002083_pt_000	Auxiliar de educação no ensino secundário
C002083_pt_001	Auxiliar de ação educativa
C002083_pt_002	Técnica de ação educativa
C002083_pt_003	Técnico de ação educativa
C002084_pt_000	Técnico de sistemas de aquecimento, de refrigeração e ar condicionado/Técnica de sistemas de aquecimento, de refrigeração e ar condicionado
C002084_pt_001	Técnica de sistemas de aquecimento, de refrigeração e ar condicionado
C002084_pt_002	Técnico de sistemas de aquecimento, de refrigeração e ar condicionado
C002085_pt_000	Agente de viagens
C002085_pt_001	Agente de reservas
C002085_pt_002	Agente de vendas
C002086_pt_000	Engenheiro projetista de ferramentas/Engenheira projetista de ferramentas
C002086_pt_001	Engenheira projetista de ferramentas
C002086_pt_002	Engenheiro projetista de ferramentas
C002087_pt_000	Gestor de licenças/Gestora de licenças
C002087_pt_001	Gestor de licenças
C002087_pt_002	Gestora de licenças
C002088_pt_000	Operador de tuneladora/ Operadora de tuneladora
C002088_pt_001	Operador de tuneladora
C002088_pt_002	Operadora de tuneladora
C002089_pt_000	Aderecista
C002090_pt_000	Diretor de controlo da conformidade e de segurança no domínio do jogo/Diretora de controlo da conformidade e de segurança no domínio do jogo
C002090_pt_001	Diretor de conformidade
C002090_pt_002	Diretor de controlo da conformidade e de segurança no domínio do jogo
C002090_pt_003	Diretor de segurança
C002090_pt_004	Diretora de conformidade
C002090_pt_005	Diretora de controlo da conformidade e de segurança no domínio do jogo
C002090_pt_006	Diretora de segurança
C002091_pt_000	Especialista em reciclagem e gestão de resíduos
C002092_pt_000	Analista de risco financeiro
C002092_pt_001	Analista de risco de crédito
C002092_pt_002	Analista e gestor de risco
C002092_pt_003	Analista e gestora de risco
C002092_pt_004	Gestor de risco
C002092_pt_005	Gestora de risco
C002093_pt_000	Soldador/Soldadora
C002093_pt_001	Soldador
C002093_pt_002	Soldadora
C002094_pt_000	Técnico de monitorização de águas subterrâneas/Técnica de monitorização de águas subterrâneas
C002094_pt_001	Técnica de monitorização de águas subterrâneas
C002094_pt_002	Técnico de monitorização de águas subterrâneas
C002095_pt_000	Chefe de turno em refinaria
C002096_pt_000	Diretor de tecnologia/Diretora de tecnologia
C002096_pt_001	Diretor de tecnologia
C002096_pt_002	Diretora de tecnologia
