C000001_pt_000	Profissões militares
C000002_pt_000	Oficiais das forças armadas
C000003_pt_000	Oficiais das forças armadas
C000004_pt_000	Oficiais das forças armadas
C000005_pt_000	Graduados não oficiais das forças armadas
C000006_pt_000	Graduados não oficiais das forças armadas
C000007_pt_000	Graduados não oficiais das forças armadas
C000008_pt_000	Outros membros das forças armadas
C000009_pt_000	Outros membros das forças armadas
C000010_pt_000	Outros membros das forças armadas
C000011_pt_000	Pessoal de chefia e direcção
C000012_pt_000	Directores executivos, dirigentes superiores e membros dos corpos legislativos
C000013_pt_000	Membros dos corpos legislativos e dirigentes superiores
C000014_pt_000	Membros dos corpos legislativos
C000015_pt_000	Dirigentes superiores da administração pública
C000016_pt_000	Chefes tradicionais e chefes de aldeia
C000017_pt_000	Dirigentes de organizações especializadas
C000018_pt_000	Directores-gerais
C000019_pt_000	Directores-gerais
C000020_pt_000	Directores administrativos e comerciais
C000021_pt_000	Directores de serviços às empresas e directores administrativos
C000022_pt_000	Directores financeiros
C000023_pt_000	Directores de recursos humanos
C000024_pt_000	Directores de estratégia e planeamento
C000025_pt_000	Directores administrativos e de serviços às empresas não classificados em outra parte
C000026_pt_000	Directores de vendas, marketing e desenvolvimento de negócios
C000027_pt_000	Directores de vendas e marketing
C000028_pt_000	Directores de publicidade e relações públicas
C000029_pt_000	Directores de investigação e desenvolvimento
C000030_pt_000	Directores de produção de serviços especializados
C000031_pt_000	Directores de produção na agricultura, produção animal, floresta e pesca
C000032_pt_000	Directores de produção na agricultura, produção animal e floresta
C000033_pt_000	Directores de produção na aquicultura e pesca
C000034_pt_000	Directores das indústrias transformadoras, extractivas, da construção, transportes e distribuição
C000035_pt_000	Directores das indústrias transformadoras
C000036_pt_000	Directores das indústrias extractivas
C000037_pt_000	Directores da construção e de engenharia civil
C000038_pt_000	Directores de compras, transportes e distribuição
C000039_pt_000	Directores dos serviços das tecnologias da informação e comunicação
C000040_pt_000	Directores dos serviços das tecnologias da informação e comunicação
C000041_pt_000	Directores de serviços especializados
C000042_pt_000	Directores dos serviços de cuidados de crianças
C000043_pt_000	Directores dos serviços de saúde
C000044_pt_000	Directores dos serviços de cuidados a pessoas idosas
C000045_pt_000	Directores dos serviços de apoio social
C000046_pt_000	Directores dos serviços de educação
C000047_pt_000	Directores de sucursais de bancos, serviços financeiros e de seguros
C000048_pt_000	Directores de outros serviços especializados
C000049_pt_000	Directores e gerentes de hotelaria, de restauração, do comércio e de outros serviços
C000050_pt_000	Directores e gerentes, de hotelaria e restauração
C000051_pt_000	Directores e gerentes de hotelaria
C000052_pt_000	Directores e gerentes de restauração
C000053_pt_000	Directores e gerentes de comércio retalhista e grossista
C000054_pt_000	Directores e gerentes de comércio retalhista e grossista
C000055_pt_000	Directores e gerentes, de outros serviços
C000056_pt_000	Directores e gerentes de centros desportivos, recreativos e culturais
C000057_pt_000	Directores de outros serviços, n.e.
C000058_pt_000	Especialistas das actividades intelectuais e científicas
C000059_pt_000	Especialistas das ciências e engenharia
C000060_pt_000	Especialistas das ciências físicas e ciências da Terra
C000061_pt_000	Físicos e astrónomos
C000062_pt_000	Meteorologistas
C000063_pt_000	Químicos
C000064_pt_000	Geólogos e geofísicos
C000065_pt_000	Matemáticos, actuários e estaticistas
C000066_pt_000	Matemáticos, actuários e estaticistas
C000067_pt_000	Especialistas das ciências da vida
C000068_pt_000	Biólogos, botânicos, zoólogos e especialistas similares
C000069_pt_000	Engenheiros agrónomos, consultores da pesca e similares
C000070_pt_000	Especialistas de protecção ambiental
C000071_pt_000	Engenheiros (excluindo de electrotecnologia)
C000072_pt_000	Engenheiros industriais e de produção
C000073_pt_000	Engenheiros civis
C000074_pt_000	Engenheiros do ambiente
C000075_pt_000	Engenheiros mecânicos
C000076_pt_000	Engenheiros químicos
C000077_pt_000	Engenheiros de minas, metalúrgicos e especialistas similares
C000078_pt_000	Outros engenheiros (excluindo de electrotecnologia)
C000079_pt_000	Engenheiros de electrotecnologia
C000080_pt_000	Engenheiros electrotécnicos
C000081_pt_000	Engenheiros de electrónica
C000082_pt_000	Engenheiros de telecomunicações
C000083_pt_000	Arquitectos, urbanistas, agrimensores e designers
C000084_pt_000	Arquitectos de edifícios
C000085_pt_000	Arquitectos paisagistas
C000086_pt_000	Designers de produto e vestuário
C000087_pt_000	Urbanistas, de cidade e tráfego
C000088_pt_000	Cartógrafos e agrimensores
C000089_pt_000	Designers gráficos e de multimédia
C000090_pt_000	Profissionais de saúde
C000091_pt_000	Médicos
C000092_pt_000	Médicos de clínica geral
C000093_pt_000	Médicos especialistas
C000094_pt_000	Enfermeiros
C000095_pt_000	Enfermeiros generalistas e especialistas
C000096_pt_000	Enfermeiros especialistas em saúde materna e obstetrícia
C000097_pt_000	Especialistas das medicinas tradicionais e alternativas
C000098_pt_000	Especialistas das medicinas tradicionais e alternativas
C000099_pt_000	Profissionais paramédicos
C000100_pt_000	Profissionais paramédicos
C000101_pt_000	Veterinários
C000102_pt_000	Veterinários
C000103_pt_000	Outros profissionais de saúde
C000104_pt_000	Médicos dentistas
C000105_pt_000	Farmacêuticos
C000106_pt_000	Especialistas em higiene e saúde, ambiental e laboral
C000107_pt_000	Fisioterapeutas
C000108_pt_000	Dietistas e nutricionistas
C000109_pt_000	Audiologistas e terapeutas da fala
C000110_pt_000	Optometristas e ópticos oftálmicos
C000111_pt_000	Outros profissionais de saúde, n.e.
C000112_pt_000	Professores
C000113_pt_000	Professores dos ensinos universitário e superior
C000114_pt_000	Professores dos ensinos universitário e superior
C000115_pt_000	Professores dos ensinos tecnológico, artístico e profissional
C000116_pt_000	Professores dos ensinos tecnológico, artístico e profissional
C000117_pt_000	Professores dos ensinos básico (2.o e 3.o ciclos) e secundário
C000118_pt_000	Professores dos ensinos básico (2.o e 3.o ciclos) e secundário
C000119_pt_000	Professores do ensino básico (1.o ciclo) e educadores de infância
C000120_pt_000	Professores do ensino básico (1.o ciclo)
C000121_pt_000	Educadores de infância
C000122_pt_000	Outros especialistas do ensino
C000123_pt_000	Especialistas em métodos de ensino
C000124_pt_000	Professores do ensino especial
C000125_pt_000	Outros professores de línguas
C000126_pt_000	Outros professores de música
C000127_pt_000	Outros professores de artes
C000128_pt_000	Formadores de tecnologias da informação
C000129_pt_000	Outros especialistas de ensino, n.e.
C000130_pt_000	Especialistas em administração e negócios
C000131_pt_000	Especialistas em finanças e contabilidade
C000132_pt_000	Contabilistas
C000133_pt_000	Consultores financeiros e de investimentos
C000134_pt_000	Analistas financeiros
C000135_pt_000	Especialistas em organização administrativa
C000136_pt_000	Analistas em gestão e organização
C000137_pt_000	Especialistas em políticas da administração
C000138_pt_000	Especialistas em recursos humanos
C000139_pt_000	Especialistas em formação e desenvolvimento de recursos humanos
C000140_pt_000	Especialistas de vendas, marketing e relações públicas
C000141_pt_000	Especialistas em publicidade e marketing
C000142_pt_000	Especialistas em relações públicas
C000143_pt_000	Especialistas em vendas, de material técnico e médico (excluindo TIC)
C000144_pt_000	Especialistas em vendas, de tecnologias da informação e comunicação
C000145_pt_000	Especialistas em tecnologias da informação e comunicação
C000146_pt_000	Analistas e programadores de software e aplicações
C000147_pt_000	Analistas de sistemas
C000148_pt_000	Programadores de software
C000149_pt_000	Programadores de sítios web e de multimédia
C000150_pt_000	Programadores de aplicações
C000151_pt_000	Outros analistas e programadores de software e aplicações
C000152_pt_000	Especialistas em bases de dados e redes
C000153_pt_000	Administradores e especialistas de concepção de bases de dados
C000154_pt_000	Administradores de sistemas
C000155_pt_000	Especialistas de redes informáticas
C000156_pt_000	Outros especialistas de bases de dados e redes
C000157_pt_000	Especialistas em assuntos jurídicos, sociais, artísticos e culturais
C000158_pt_000	Especialistas em assuntos jurídicos
C000159_pt_000	Advogados
C000160_pt_000	Juízes e magistrados
C000161_pt_000	Outros especialistas em assuntos jurídicos
C000162_pt_000	Bibliotecários, arquivistas e curadores de museus
C000163_pt_000	Arquivistas e curadores de museus
C000164_pt_000	Bibliotecários e outros especialistas de informação relacionados
C000165_pt_000	Especialistas em ciências sociais e religiosas
C000166_pt_000	Economistas
C000167_pt_000	Sociólogos, antropólogos e especialistas similares
C000168_pt_000	Filósofos, historiadores e especialistas das ciências políticas
C000169_pt_000	Psicólogos
C000170_pt_000	Especialistas do trabalho social
C000171_pt_000	Ministros de culto e membros de ordens religiosas
C000172_pt_000	Autores, jornalistas e linguistas
C000173_pt_000	Autores e outros escritores
C000174_pt_000	Jornalistas
C000175_pt_000	Tradutores, intérpretes e outros linguistas
C000176_pt_000	Artistas criativos e das artes do espectáculo
C000177_pt_000	Artistas de artes visuais (plásticas)
C000178_pt_000	Músicos, cantores e compositores
C000179_pt_000	Bailarinos e coreógrafos
C000180_pt_000	Encenadores, realizadores e directores e produtores similares
C000181_pt_000	Actores
C000182_pt_000	Locutores e apresentadores de rádio, televisão e outros meios de comunicação
C000183_pt_000	Outros artistas criativos e das artes do espectáculo
C000184_pt_000	Técnicos e profissões de nível intermédio
C000185_pt_000	Técnicos e profissões das ciências e engenharia, de nível intermédio
C000186_pt_000	Técnicos das ciências físicas e engenharia
C000187_pt_000	Técnicos das ciências químicas e físicas
C000188_pt_000	Técnicos de engenharia civil
C000189_pt_000	Técnicos de electrotecnia
C000190_pt_000	Técnicos de electrónica
C000191_pt_000	Técnicos de engenharia mecânica
C000192_pt_000	Técnicos de química industrial
C000193_pt_000	Técnicos da indústria extractiva e metalúrgica
C000194_pt_000	Desenhadores
C000195_pt_000	Outros técnicos das ciências físicas e da engenharia
C000196_pt_000	Supervisores de indústrias extractivas, transformadoras e construção
C000197_pt_000	Supervisores de indústrias extractivas
C000198_pt_000	Supervisores de indústrias transformadoras
C000199_pt_000	Supervisores de construção
C000200_pt_000	Técnicos de controlo de processos industriais
C000201_pt_000	Operadores de instalações de produção de energia
C000202_pt_000	Operadores de incineradores e instalações de tratamento de água
C000203_pt_000	Técnicos de controlo de instalações da indústria química
C000204_pt_000	Operadores de instalações de refinação de petróleo e gás natural
C000205_pt_000	Técnicos de controlo de instalações de produção de metais
C000206_pt_000	Outros técnicos de controlo de processos industriais
C000207_pt_000	Técnicos e profissões afins, de nível intermédio das ciências da vida
C000208_pt_000	Técnicos das ciências da vida (excluindo medicina)
C000209_pt_000	Técnicos agrícolas e da produção animal
C000210_pt_000	Técnicos florestais
C000211_pt_000	Técnicos e controladores, dos meios de transporte marítimos e aéreos
C000212_pt_000	Oficiais maquinistas de navios
C000213_pt_000	Oficiais de convés e pilotos de navios
C000214_pt_000	Pilotos de avião e profissionais associados
C000215_pt_000	Controladores de tráfego aéreo
C000216_pt_000	Técnicos de segurança aérea
C000217_pt_000	Técnicos da área da saúde, de nível intermédio
C000218_pt_000	Técnicos de medicina e de farmácia
C000219_pt_000	Técnicos de equipamentos de imagiologia médica e terapêutica
C000220_pt_000	Técnicos de laboratório, de anatomia patológica e medicina
C000221_pt_000	Técnicos e assistentes, farmacêuticos
C000222_pt_000	Técnicos de próteses médicas e dentárias
C000223_pt_000	Auxiliares de enfermagem e obstetrícia
C000224_pt_000	Auxiliares de enfermagem
C000225_pt_000	Auxiliares de obstetrícia
C000226_pt_000	Profissionais de nível intermédio das medicinas tradicionais e alternativas
C000227_pt_000	Profissionais de nível intermédio das medicinas tradicionais e alternativas
C000228_pt_000	Técnicos e assistentes veterinários
C000229_pt_000	Técnicos e assistentes veterinários
C000230_pt_000	Outros profissionais de nível intermédio da saúde
C000231_pt_000	Assistentes e terapeutas de medicina dentária
C000232_pt_000	Técnicos de registos médicos e de informação sobre saúde
C000233_pt_000	Técnicos dos serviços de saúde comunitária
C000234_pt_000	Ópticos
C000235_pt_000	Técnicos e assistentes de fisioterapia
C000236_pt_000	Assistentes de médicos
C000237_pt_000	Inspectores e técnicos de saúde ambiental e do trabalho
C000238_pt_000	Técnicos de ambulância
C000239_pt_000	Outros profissionais de nível intermédio da saúde, n.e.
C000240_pt_000	Técnicos de nível intermédio, das áreas administrativas e de negócios
C000241_pt_000	Técnicos de nível intermédio da área financeira e matemática
C000242_pt_000	Cambistas e corretores de bolsa e similares
C000243_pt_000	Agentes de créditos e empréstimos
C000244_pt_000	Técnicos de contabilidade
C000245_pt_000	Técnicos de nível intermédio da estatística, matemática e similares
C000246_pt_000	Avaliadores
C000247_pt_000	Agentes de compras e de vendas e corretores
C000248_pt_000	Agentes de seguros
C000249_pt_000	Representantes comerciais
C000250_pt_000	Compradores
C000251_pt_000	Corretores de mercadorias
C000252_pt_000	Agentes de negócios
C000253_pt_000	Despachantes
C000254_pt_000	Organizadores de conferências e eventos
C000255_pt_000	Agentes de emprego e contratadores de mão-de-obra
C000256_pt_000	Agentes imobiliários e gestores de património
C000257_pt_000	Outros agentes de negócios
C000258_pt_000	Secretários de administração e especializados
C000259_pt_000	Chefe de escritório
C000260_pt_000	Secretários da área jurídica
C000261_pt_000	Secretários, administrativo e executivo
C000262_pt_000	Secretários da área da medicina
C000263_pt_000	Agentes de nível intermédio da administração pública, para aplicação da lei e similares
C000264_pt_000	Inspectores das alfândegas e fronteiras
C000265_pt_000	Agentes dos impostos
C000266_pt_000	Agentes dos serviços da segurança social
C000267_pt_000	Agentes dos serviços de licenças e autorizações
C000268_pt_000	Inspectores de polícia e detectives
C000269_pt_000	Outros agentes de nível intermédio para aplicação da lei e similares
C000270_pt_000	Técnicos de nível intermédio dos serviços jurídicos, sociais, culturais e similares
C000271_pt_000	Técnicos de nível intermédio dos serviços jurídicos, sociais e religiosos
C000272_pt_000	Técnicos de nível intermédio dos serviços jurídicos e relacionados
C000273_pt_000	Técnicos de nível intermédio de apoio social
C000274_pt_000	Técnicos de nível intermédio de apoio religioso
C000275_pt_000	Técnicos do desporto e de ginásio (fitness)
C000276_pt_000	Atletas e desportistas, de competição
C000277_pt_000	Treinadores, instrutores e árbitros, desportivos
C000278_pt_000	Instrutores e monitores, de educação física e de recreação
C000279_pt_000	Técnicos de nível intermédio das actividades culturais, artísticas e culinárias
C000280_pt_000	Fotógrafos
C000281_pt_000	Designers de interiores e decoradores
C000282_pt_000	Técnicos de galerias de arte, museus e bibliotecas
C000283_pt_000	Chefes de cozinha
C000284_pt_000	Outros técnicos de nível intermédio das actividades culturais e artísticas
C000285_pt_000	Técnicos das tecnologias de informação e comunicação
C000286_pt_000	Técnicos, das tecnologias da informação e comunicação e de apoio aos utilizadores
C000287_pt_000	Técnicos das tecnologias da informação e comunicação
C000288_pt_000	Técnicos de apoio ao utilizador das tecnologias da informação e comunicação
C000289_pt_000	Técnicos de redes e sistemas de computadores
C000290_pt_000	Técnicos da web
C000291_pt_000	Técnicos de telecomunicações e de emissões de rádio e televisão
C000292_pt_000	Técnicos de emissões de rádio e televisão e de gravação audiovisual
C000293_pt_000	Técnicos de telecomunicações
C000294_pt_000	Empregados administrativos
C000295_pt_000	Empregados de escritório
C000296_pt_000	Empregados de escritório – funções gerais
C000297_pt_000	Empregados de escritório – funções gerais
C000298_pt_000	Secretários (funções gerais)
C000299_pt_000	Secretários (funções gerais)
C000300_pt_000	Operadores de processamento, de texto e dados
C000301_pt_000	Dactilógrafos e operadores de processamento de texto
C000302_pt_000	Operadores de registo de dados
C000303_pt_000	Empregados de atendimento ao público
C000304_pt_000	Caixas, bilheteiros e trabalhadores similares
C000305_pt_000	Caixas bancários e similares
C000306_pt_000	Empregados de apostas, em casinos e similares
C000307_pt_000	Penhoristas e prestamistas
C000308_pt_000	Cobradores de facturas e similares
C000309_pt_000	Empregados que prestam informações ao cliente
C000310_pt_000	Empregados das agências de viagem e similares
C000311_pt_000	Empregados dos centros de chamadas
C000312_pt_000	Operadores de centrais telefónicas
C000313_pt_000	Recepcionistas de hotel
C000314_pt_000	Empregados de serviços de informação ao cliente
C000315_pt_000	Recepcionistas (funções gerais)
C000316_pt_000	Entrevistadores de inquéritos e estudos de mercado
C000317_pt_000	Outros empregados que prestam informações ao cliente
C000318_pt_000	Empregados de contabilidade e registo de materiais
C000319_pt_000	Empregados de contabilidade, estatística, financeiros e similares
C000320_pt_000	Empregados, de contabilidade e escrituração comercial
C000321_pt_000	Empregados, dos serviços de estatística, financeiros e seguros
C000322_pt_000	Empregados dos serviços de pagamento de salários
C000323_pt_000	Empregados de aprovisionamento, de planeamento e dos transportes
C000324_pt_000	Empregados de aprovisionamento e armazém
C000325_pt_000	Empregados dos serviços de apoio à produção
C000326_pt_000	Empregados dos serviços de transportes
C000327_pt_000	Outros empregados de apoio administrativo
C000328_pt_000	Outros empregados de apoio administrativo
C000329_pt_000	Empregados de biblioteca
C000330_pt_000	Carteiros e similares
C000331_pt_000	Codificadores, revisores de provas e similares
C000332_pt_000	Escrivães públicos e similares
C000333_pt_000	Classificadores arquivistas
C000334_pt_000	Empregados dos serviços de pessoal
C000335_pt_000	Outros empregados de apoio administrativo, n.e.
C000336_pt_000	Pessoal dos serviços e vendedores
C000337_pt_000	Pessoal dos serviços pessoais
C000338_pt_000	Assistentes de viagem, cobradores, revisores e guias intérpretes
C000339_pt_000	Assistentes de viagem, e comissários
C000340_pt_000	Cobradores, revisores de bilhetes e trabalhadores similares dos transportes
C000341_pt_000	Guias-intérpretes
C000342_pt_000	Cozinheiros
C000343_pt_000	Cozinheiros
C000344_pt_000	Empregados de mesa e de bar
C000345_pt_000	Empregados de mesa
C000346_pt_000	Empregados de bar
C000347_pt_000	Cabeleireiros, esteticistas e similares
C000348_pt_000	Cabeleireiros
C000349_pt_000	Esteticistas e similares
C000350_pt_000	Encarregados de limpeza e de trabalhos domésticos
C000351_pt_000	Encarregados de limpeza e de trabalhos domésticos em escritórios, hotéis e outros estabelecimentos
C000352_pt_000	Governantes e mordomos domésticos
C000353_pt_000	Porteiros de edifícios
C000354_pt_000	Outro pessoal dos serviços pessoais
C000355_pt_000	Astrólogos, adivinhadores e similares
C000356_pt_000	Pessoal de companhia e ajudantes de quarto
C000357_pt_000	Agentes funerários e embalsamadores
C000358_pt_000	Tratadores e guardadores de animais
C000359_pt_000	Instrutores de condução
C000360_pt_000	Outro pessoal dos serviços pessoais, n.e.
C000361_pt_000	Vendedores
C000362_pt_000	Vendedores em mercados e vendedores ambulantes
C000363_pt_000	Vendedores em quiosques e mercados
C000364_pt_000	Vendedores ambulantes de produtos comestíveis
C000365_pt_000	Vendedores em lojas
C000366_pt_000	Comerciantes de loja
C000367_pt_000	Supervisores de loja
C000368_pt_000	Vendedores em loja
C000369_pt_000	Operadores de caixa e de venda de bilhetes
C000370_pt_000	Operadores de caixa e de venda de bilhetes
C000371_pt_000	Outros trabalhadores relacionados com vendas
C000372_pt_000	Manequins e outros modelos
C000373_pt_000	Demonstradores em lojas
C000374_pt_000	Vendedores ao domicílio
C000375_pt_000	Vendedores de centros de contacto
C000376_pt_000	Empregados de estações de serviço
C000377_pt_000	Empregados de venda de alimentos ao balcão
C000378_pt_000	Outros trabalhadores relacionados com vendas, n.e.
C000379_pt_000	Trabalhadores de serviços de assistência pessoal
C000380_pt_000	Auxiliares de cuidados de crianças e auxiliares de educação
C000381_pt_000	Auxiliares de cuidados de crianças
C000382_pt_000	Auxiliares de educação
C000383_pt_000	Trabalhadores de assistência pessoal nos serviços de saúde
C000384_pt_000	Assistentes de cuidados de saúde
C000385_pt_000	Ajudantes familiares
C000386_pt_000	Outros trabalhadores de serviços de assistência pessoal nos serviços de saúde
C000387_pt_000	Pessoal dos serviços de protecção e segurança
C000388_pt_000	Pessoal dos serviços de protecção e segurança
C000389_pt_000	Bombeiros
C000390_pt_000	Agentes de polícia
C000391_pt_000	Guardas dos serviços prisionais
C000392_pt_000	Agentes de segurança
C000393_pt_000	Outro pessoal dos serviços de protecção e segurança
C000394_pt_000	Trabalhadores qualificados da agricultura, da silvicultura e da pesca
C000395_pt_000	Trabalhadores qualificados da agricultura orientadas para o mercado
C000396_pt_000	Floricultores e trabalhadores qualificados de culturas agrícolas de mercado
C000397_pt_000	Trabalhadores qualificados de produção de cereais e vegetais
C000398_pt_000	Trabalhadores qualificados de árvores e arbustos
C000399_pt_000	Floricultores, horticultores e viveiristas
C000400_pt_000	Trabalhadores qualificados de culturas agrícolas mistas
C000401_pt_000	Produtores e trabalhadores qualificados na criação de animais
C000402_pt_000	Produtores e trabalhadores qualificados na criação de animais e produtores de leite
C000403_pt_000	Trabalhadores qualificados da avicultura
C000404_pt_000	Apicultores e sericultores
C000405_pt_000	Outros produtores e trabalhadores qualificados da criação de animais
C000406_pt_000	Agricultores e trabalhadores qualificados da agricultura e da criação animal combinadas
C000407_pt_000	Agricultores e trabalhadores qualificados da agricultura e da criação animal combinadas
C000408_pt_000	Trabalhadores qualificados da silvicultura, da pesca e da caça, orientadas para o mercado
C000409_pt_000	Trabalhadores florestais e similares
C000410_pt_000	Trabalhadores florestais e similares
C000411_pt_000	Trabalhadores qualificados da aquicultura, das pescas, caçadores e utilizadores de armadilhas
C000412_pt_000	Trabalhadores qualificados da aquicultura
C000413_pt_000	Trabalhadores qualificados da pesca – águas costeiras e interiores
C000414_pt_000	Trabalhadores qualificados da pesca do alto mar
C000415_pt_000	Caçadores qualificados e utilizadores de armadilhas
C000416_pt_000	Agricultores, pescadores, caçadores e recolectores de subsistência
C000417_pt_000	Agricultores de subsistência
C000418_pt_000	Agricultores de subsistência
C000419_pt_000	Criadores de animais de subsistência
C000420_pt_000	Criadores de animais de subsistência
C000421_pt_000	Agricultores e produtores de animais de subsistência, combinadas
C000422_pt_000	Agricultores e produtores de animais de subsistência, combinadas
C000423_pt_000	Pescadores, caçadores, utilizadores de armadilhas e recolectores de subsistência
C000424_pt_000	Pescadores, caçadores, utilizadores de armadilhas e recolectores de subsistência
C000425_pt_000	Operários, artífices e trabalhadores similares
C000426_pt_000	Trabalhadores qualificados da construção excluindo electricistas
C000427_pt_000	Trabalhadores qualificados da construção das estruturas básicas e similares
C000428_pt_000	Construtores de edifícios
C000429_pt_000	Pedreiros e trabalhadores similares
C000430_pt_000	Trabalhadores da pedra, canteiros e similares
C000431_pt_000	Trabalhadores em betão armado e similares
C000432_pt_000	Carpinteiros e marceneiros
C000433_pt_000	Outros trabalhadores qualificados da construção das estruturas básicas e similares
C000434_pt_000	Trabalhadores qualificados da construção em acabamentos e similares
C000435_pt_000	Colocadores de telhados e coberturas
C000436_pt_000	Assentadores de revestimentos e ladrilhadores
C000437_pt_000	Estucadores
C000438_pt_000	Trabalhadores em isolamentos
C000439_pt_000	Vidraceiros
C000440_pt_000	Canalizadores e instaladores de tubagens
C000441_pt_000	Instaladores de ar condicionado e de sistemas de refrigeração
C000442_pt_000	Pintores, limpadores de fachadas e similares
C000443_pt_000	Pintores da construção e similares
C000444_pt_000	Pintores à pistola e envernizadores
